,user,review,date,user_score,review_votes,review_upvotes,review_downvotes,language
452,smoothpantagana,"Yeah, I hoped for a good film, but this was nowhere near one…As it stands the first part of this duology is a much stronger film. So Infinity War &gt; Endgame. By a huge margin, I would add…SPOILERS AHEADEndgame was rather disappointing and slow, the pacing was awful, and it just sort of fizzed out by the end of it, not even the death of Iron-Man felt special. His previous fight with Thanos on Titan felt more impactful. And that’s just it… The film rang hollow as a whole. It just did not flow as easily as Infinity War, and was lost in its time travel shenanigans… Spider-Mans and Peppers goodbyes felt like ticks on squares. Its like the rollercoaster ride was a flat line that didn’t take the highs to where they should have soared and as a result it meandered through long stretches of melancholy emotions and dialogues, many of which could have been cut shorter. They lost on film, on action, to honour characters, parents, loss, grief, friendship... I get that, but it’s a lot and too much at times, so they lost the dynamics of film in the process. The films story-telling suffered. Its depressive opening tone was soon undercut by its trademark one-liners and quips, and it soon felt like the whole film was straying in a strange direction where the filmmakers couldn’t decide which way to go and how they wanted to paint the film as it were. The way they went with many of its characters and their moments felt like they were not holding up or were just jarring. Some of these are…What have they done to Thor? It feels like they ran out of creativity so they lazily shat on his character and made him a **** and a loser. Also, Thor somehow beats Thanos with a fully gemmed glove with Stormbreaker, but can’t do so with Mjolnir and Stormbreaker against Thanos without any gems? Where is the consistency? Also, if he takes Mjolnir from another timeline than what does Thor fight with in that timeline, in the Dark World and Ragnarok?What have they done to Hulk?  We don’t get any action from the Big Green. Its especially disappointing after he was held back in Infinity War. So there is no payoff for Hulk? Really? They fumbled his character where he should have unleashed the monster and overcome his fear of Thanos. Big mistake character wise. They left him unused. One-armed and weak. Shame, it still feels like such a huge and glaring missed opportunity.Also, the whole soulstone bit with Widow and Hawkeye just feels like a cheap gimmick after the drama with Thanos and Gamora in the previous film. Hawkeye is mourning the love of his life, his family, so the Russos make him ultimately sacrifice himself for a collegue from office? Cause that’s how their relationship always felt. Isn’t getting the soulstone about the ultimate sacrifice one makes? Why didn’t Banner go with Natasha? It would have made more sense soulstone story wise? Hell, Cap had more chemistry with the Black Widow than Hawkeye… Odd choices.There are many other missteps (a friggin rat?), but in conclusion: Nothing remarkable happens for the first two hours (for an action spectacle film, spectacular action is nowhere to be seen) and the third act or hour feels overstuffed and incomprehensible, with dialogues and action all over the place. Where Infinity War was good at balancing characters, acts and plotlines, Endgame is nowhere near as coherent. The last act feels like too much of everything, and very little of it is quality. Honestly, Endgame does not FEEL like a magical blockbuster experience after you exit the theatre, nor does it deserve a higher grade than a 5/10.",2019-04-26,5,71,22,49,English
453,Rhodawgs,47 out of 100 . Enjoyable somewhat but is clearly set out for closure needing fan base.  Poor script and dull emotional baggage bonded with lucky plot scenes over and over again. Compared to the comic unimaginative and another same old loophole movie dragged out over 3hrs...... entertaining in parts but the 6 rolls in every scene for every instance with these defeated bunch brings eyerolls for the most part. Especially the absolute silly she scenes eyerolls pretty much just barely keeping you awake at this point. Thanos character is inconsistent and stripped down  let alone others in the movie.  Plenty of plot holes and sub plots that are just to rubbish to expand on. The last movie was much better and I'm sure many needed the enjoyment of closure around the story. But a stained finish to the marvel seris really and kinda left out a movie for everyone. The movie was about bringing back and includeing everyone but the movie was catered towards certain audiences and lack luster scenes of luck isn't up to scratch and was a below par mashup . Long . Lazy.,2019-04-26,4,85,26,59,English
454,kaenek,"It feels and watches like a seasin finale of a series. You don't expect it to be good. You expect certain thing to happen. They happen. And it's not good. This picture is about 4 of the avengers. The rest is not important and non-existent. Tip for Disney: when you hype different, fake plots to keep the real one secret, try to make this real one better then the fakes...",2019-04-26,3,164,48,116,English
455,Lundorff,It is unfortunately but not unexpected that they would drop the ball at the end. There are simply too many characters and the story is quite boring and messed up.,2019-04-26,3,135,38,97,English
456,Sigmacenturion,It is a ten year build with ten years of plot holes that pile up. The most notably happen when a lot of Age of Ultron plot points are forgotten and characters lose abilities and information for Thanos to be a threat. The humor in this movie is too overpowering considering the situation. How they did Thor and Hulk dirty was a major turn off. This movie didn't live up to the hype. The last 30 minute is good but then you are left with mainly plotholes in that fight as everyone waits their turn while dispatching easy killable villains and disappearing air support that ignores enemy ships for Captain Marvel. The whole run the gauntlet is stupid considering they have an army of teleporting sorcerers who can also just teleport Thanos to pieces or just drop him into the upper atmosphere. Hulk doesn't redeem himself from his lacklust performance in Infinity War.,2019-04-27,2,80,22,58,English
457,Alternative4,It kinda feels like they phoned it in this time around along with Captain Marvel being an objectively **** **** hero due to her powers. I dont know it just didnt feel right in the slightest in comparison to infinity war.,2019-04-26,3,99,27,72,English
458,Elakking,"As always great action and visuals, terrible plot and storytelling. I'm really disappointed they went the time travel route, it's one of the cheapest storytelling devices, especially when it's used in a completely unoriginal way like this.",2019-04-26,2,78,21,57,English
459,ChillJohnHill,"It was far too long (for the last hour and a half i was hoping it would just end already), a lot of cringey geek moments (camera stares when a character shows up that you forgot about, happens about 20 times, stupid catch phrases from previous movies), tried wayyyy too hard to be serious and sad (its a comic book movie, just make it fun), the sound track was meh at best and lastly and most importantly you saw Jeremy Renner’s atrocious haircut wayyyyy too much.",2019-04-26,3,134,36,98,English
460,bubba5,"Whiny, boring and way too long. Captain marvel was forced into this movie to be a glorified intergalactic uber for two seconds. hulk goes into a teleporter with dr Phil and can now smash and do your taxes at the same time. Infinity stones used to cause instant death, but can now be held by anyone. Its gross that a movie this bad will inevitably be one of the most profitable movies of all time. The professional reviewers should be ashamed to give such a mediocre movie glowing reviews.",2019-04-26,1,127,33,94,English
461,fcschettini,"Boring, long and far below expectation after the great movie infinity war. First two hours trying to explain crazy time travel theories. Last hour, with more action, nonsense dialogues, dark battles and low impact after return of heroes previously swept. Didn´t like it.",2019-04-26,3,135,35,100,English
462,Siome,"Boring, trunkated characters, plotholes, stupid story, badly managed drama. Way to long... All events are predicted from A:IF easily, no surprises. Worst possible ending of the saga. Goodby my dreams of an epic conclusion. And a last question... How can universe can still exist if the one that make it like this disapear before doing it ? Storytelling noobs... Stop ruining my childhood superheroes...",2019-04-26,2,133,34,99,English
463,Oscarretrogames,"This is the biggest fail I ever seen. I loved precedent chapters, I really wonder how they could change an awesome heroic adventure into a poor comedy with no action (6 minutes of fight on 3 hours? Less?) I can't imagine how Hulk's or Thor's fans are thinking about it... I'm really disappointed on this closure.",2019-04-26,0,144,36,108,English
464,KnightKing,"This movie had GLARING plot holes and character inconsistencies but i'll focus on just Cap here.   How did he show up as an old man?   If he was able to go back in time and rewrite things, which is what they tried to explain was not possible, then how did he go back and marry Peggy?   Also,  Tony just died and the universe was just attacked----and he decides to sit on the bench after that?    Also,  how did he return the stones in it's original form i.e. the space stone back into the tesseract.   Once everybody calms down you'll see that this movie was a gigantic mess that the Ready Player One climax does not make-up for.    Act 1:  Leftovers TV show  Act 2:  Back To The Future/Time Travel that fails to stick to it's own logic  Act 3:  Ready Player One/fan service.",2019-04-27,3,72,18,54,English
465,Vothross,"I absolutely hated this movie, i thought it was boring, poorly written and inconsistent...-Time travel and the way it is used in this movie absolutely sucks, it's so convenient and almost without negative repercussions to the main time line..-Thor and Hulk are a joke in this movie.(Thor is too weak even with two hammers and the Odinforce and is fat, drinks alcohol and plays Fortnite and Hulk is basically Ruffalo with CGI and doesn't participate in any action scenes)-Captain Marvel and the way she is portrayed in this film is horrible, she just comes and one shots Thanos's entire army while Thor with 2 hammers and the Odinforce can't do anything.-in a movie with time travel elements in which they just resurrected the entire marvel universe how can Tony Stark die?can't they just go back in time and get him? (we have Gamora from the PAST living in the PRESENT now!!!)i get it that the actor's contract is ending but still..-Thor abandons his people and leaves with the Guardians???wow that was laughable, they are probably planning for a New Asgard series so probably because Hemsworth can't participate they just had to put him out of the picture like this?-Falcon is the new Captain America?why???isn't he just a regular guy..why not Bucky for example?-all female superhero moment...the amount of cringe!!!-the tone of the movie is like this...pointless drama with bad jokes-the last battle is pretty impressive but doesn't last for long and captain marvel totally ruins it...-they should have used the marvel cosmic beings and give this battle much bigger scale, after all thanos affected the entire universe not only earth.-Nebula kills her past self while being in the present and SURVIVES??!?!?!?-Pepper Pots is able to pilot the iron man armor like a pro, better than War Machine.-Dr. Strange does absolutely nothing in this movie, he just collect all the heroes off screen and opens some portals in the end, oh and he uses an aoe spell for half a second. These are only some of the flaws with this movie..Of course it will make a lot of money but it's mostly due to the hype and Disney's promotion which is essentially the best in the market...",2019-04-27,3,78,19,59,English
466,metacec,"Way too many plot holes and inconsistencies to be a great movie. I have always been a Marvel fan , but this is unreasonable. The time conundrum's not withstanding , I feel , the Hulk and Thor were both pushed aside. Capt. Marvel is way too OP and Capt America wielding the Hammer better than Thor? Tony Stark wielding the Gauntlet that the Hulk couldn't take? Convenience is not a good excuse for poor storytelling. Don't even consider the time element. Nothing more than a money grab by Disney and Marvel. Sadly , the fans will flock and they will feel justified. The most important part of any movie is the story. It seems harder and harder to find a cogent and entertaining movie nowadays. Hundreds of millions of dollars and this is the story they come up with? Again , a fan of Marvel since childhood , I feel betrayed. As a child , I mowed lawns so I could buy my favorite Marvel comics. Hated DC and still not really receptive to their stories or characters. I felt the same way with The Last Jedi. So maybe it's a Disney thing. In summation , this movie is truly disappointing for me. A lifelong Marvel fan , maybe it's time to watch something else.",2019-04-26,4,62,15,47,English
467,MarkCro,"It's in my opinion the worst marvel movie I've seen and I've seen all except for the captian marvel movie. I loved the previous avengers movie, which I rated 9 out of 10. I was looking forward to the movie and got disappointed big time.Endgame is slow. I mean really slow. The first 2,5 h you barley see a action scene. It's full of plot holes, which make the movie unbelieveable. I know its fiction but that doesn't mean you can cut all the logic and get away with it. The plot itself was very predictable but there was not much plot left when you take the jokes and the fanservice away. The antagonist was reduced to the absolute minimum. Infinity War build Thanos as the best and complex villain in the MCU, just to turn him into a one dimensional world destroyer. They alter their characters in parodic ways. Some may find it funny but not me. The humor is also a big factor. Infinity War had funny moments but this was a absolute gatling gun fire of unnecessary jokes and none of them hit. The jokes were overdone and they rode the dead horse many times which lead me to hide my face behind my hands for most of the time.We need better ending to all these years of loyalty. So many things in this movie are unreasonable. This movie needs to be snapped out of existence...",2019-04-26,1,76,18,58,English
468,AsukaLS,"I saw the movie yesterday. I'm not a Marvel fan but I saw the Avengers saga and the last movie was good.- Captain Marvel appears at the beginning of the film with some effects taken from a class B movie following a scene with an extremely arrogant dialogue on his part front of the other Avengers. (Come on! you did not appear in the other movies!). Then she disappears during the next 2 hours of film (I guess she went to take a haircut in that time) and she returns to destroy Thanos' ship in a ridiculous way. No one on earth is capable of destroying it? Or do something? Come on!.- The Incredible Hulk takes two whole movies without even giving a slap. It is one of the most important characters in Marvel comics and his scenes seem that they were of a film of Shrek (With a little more of intellect).- Thor... I have no words to describe how they humiliated one of the strongest Avengers. Marvel should never again print a Thor comic after this. I hope to make a team with him in a videogame or see him in a pub sometime. (Or maybe one day I find him playing bowling with Walter).- I did not finish to understand the trips in the time. More precisely in the scene that Antman returns to the present. I do not remember if it was in a previous movie or when he set up that machine. A friend told me what happened in one of the 23 MCU movies. But if to understand 1 movie I must see 23 movies something is wrong. - Excessive humor in the whole movie. It also happened in all the saga. There are moments of tension that need some seriousness in the movies but are ruined by some silly joke.- Unnecessary feminist fight- I did not like the dialogue of the final scene with Thanos saying ""I am inevitable"" and Ironman answering ""I am Iron Man"". I think it would have been better if he said ""We are The Avengers"".Throughout the saga there were moments that seemed to be watching Iron Man movies with sporadic participation of some characters.That final dialogue finished confirming that the saga should be titled as ""Iron Man and The Advengers""- I think the duration was long, maybe 2 and a half hours (or a little less) would have been enough.They missed the opportunity to give a great closing to a saga that began from minor to major.I want to congratulate the sound director and his team. The rest take a break and rethink if you want to continue doing bad movies.",2019-04-28,2,76,18,58,English
469,bamjama,"Fell flat. Started high but slowly declined into boredom. Certainly the plot and characters are all subversive, but so is eating what you think is a chocolate chip cookie and finding raisins instead.",2019-04-26,0,107,25,82,English
470,ShamrockVA,"Poor and boring fight moments, stupid jokes for idiots and e hours of next thing. Fat Thor, Captain with god’s hummer and others silly moment destroyed this movie",2019-04-26,1,99,23,76,English
471,euu,"I wasn't expecting much based on the Trailers and I was still dissappointed. Infinity War was a great movie so it would have been better to just end it there because in order to bring back all their cashcows they came up with the most contrieved time travel plot I have ever seen. These things rarely work in movies and this time is no exception.But even if you turn your brain off at the stupidity of the plot there is very little left to this film. Most of it boils down to ""Member this, guys?"" moments that don't really add anything that we didn't already know to most characters and in some cases ruin them completely(Thor). Also, you can easilly remove about 60 minutes of this movie and it would actually be improved as much of it consists of characters trying to convince other characters to ""just do it"". We know that they eventually will, so why spend that much time on it?How's the action? Boring and devoid of tension. Also, in very small doses. Other the the final battle, that looks like the cutscene of some gereic video game from 10 years ago, there are very few action scenes. How are the visuals? Like most Marvel Movies, cheap and bland.And finally, for the characters, the thing these movies are most praised for? Let's just say that the character who gets the most satisfying arc in the series is freaking Nebula. I guess Cap sendoff is alright, Tony's sacrifice could have been great if there was any buildup to it. the Hulk is still a joke and Thor? Well, after many movies of development where he needs to learn to be a good king he realizes that he just needs to be himself, a fat, drunken slob and leave What's Her Face from Ragnarok to lead Asgard. Truly the best ending to a series ever!",2019-04-26,3,71,16,55,English
472,Ashton2571,"This was atrocious. Death has no meaning in this movie because the power of the gauntlet looms on your mind throughout the whole thing and then the movie pulls a random ""gotcha"" and jks on you your hero is dead.",2019-04-26,0,103,23,80,English
473,Carl897456,"The movie was bad. Not meant for people who actually care about marvel. It contained a lot of plot holes. It was boring. In a lot of scenes I was like, why did they do this? It was filled with a bunch of cheesy jokes. They just dragged the movie so much. Infinity war was amazing but this was just bad.",2019-04-27,1,68,15,53,English
475,Algoros,uninspired main plotboring at the beginningthe film stretches into the length,2019-04-26,0,125,26,99,English
476,fyte4luv808,one of the most boring MCU movies to date. so many loop holes &amp; unnecessary stale comedy that fell flat. the battle scene all 5 minutes of it in a freaking 3hr movie lmao pathetic!,2019-04-26,0,98,17,81,English
477,lemony,"Not a bad movie at all, but kind of a mess. The time travel aspect was done poorly imo and I didn't like the endings of some of the characters. This was a good ending though, I don't think Phase 4 onward is going to be anywhere near as good the previous phases.",2019-05-13,7,14,14,0,English
479,cnclark68,A complete story line with all of the desired action. I loved the Hulk take in this installment. The emotional movements throughout this movie added great depth to a fantasy super hero movie. I LOVED it !,2019-08-04,10,12,12,0,English
480,I_Am_Legacy,"MAY CONTAIN SPOILERS.Great movie, not without its problems, for example Captain Marvel should have been completely wrote out of this movie, she is a character written purely to appease the SJW types who dont even watch these movies, I dread to think what would have happened if she was in it anymore, her whole character takes away the merits the other characters have earned. If they wanted badass woman in this movie then they already have them.Secondly, time travel. While it was fun watching the various characters visit their pasts and revisiting past movies from different perspectives time travel is something that has been done 1000's of times and is not really an original concept, the vast amount of plot holes it leaves are just not worth it. Finally some characters are sidelined for the movies who really shouldn't be I'll let you decide for yourself who you think deserved more time.Overall this is a good movie, if it were up to me I would have done it differently really its only introducing an overpowered character ( Captain Marvel ) and time travel that really let it down, it basically nullifies the past losses and achievements of the movies and its characters as anything they have done can be so easily rectified.I give this movie a 7/10 I am not being too harsh I think this is just right for the movie, I will be 100% watching it again when it comes out of blu-ray.",2019-05-08,7,12,12,0,English
481,metacriticalvea,"Thank you Marvel for the ten year movie franchise. One of best, epic movie of my life. I would rewatch all the movies if I had more time. Thank you",2019-08-08,10,12,12,0,English
483,theredsky,"This is an amazing film. I love almost every aspect of this film. As a Marvel fan, I can definitely say that Avengers: Endgame is a love letter to the fans and provides a satisfying emotional conclusion. Before I get started, here is a spoiler warning. Go see Avengers: Endgame and then come back. Let’s get some negatives out of the way. Everything up until the Time Heist drags on and starts to get boring. I know that they need to set everything up for the 2nd and 3rd acts of the film but I wish they had done it better. The 2nd and 3rd acts of this film make up for this though. I also didn’t like the explanation for the their time travel. The film basically states that anything the characters do in the past doesn’t affect the future which makes no sense at all. I know that this is their own rule but it just makes no sense at all. Why would changing the past not affect the future at all. That would mean that Nebula would have disappeared when she killed her past self. The one other problem is that some of the jokes didn’t work. The positives far outweigh the negatives though. The cast does an outstanding job especially all of the main Avengers. I loved watching them together with War Machine, Nebula, and Rocket. All the supporting characters also did an amazing job. The plot can get confusing sometimes but generally, it’s understandable. The tone remains consistent throughout the film. It’s sometimes funny when it needs to be funny and it’s serious when it needs to be serious. The cinematography was fine. It wasn’t anything special. The visual effects for this film are amazing though. The armies look mostly real and Thanos looks great as always. There is a lot of emotional weight to this film which kinda surprised me. I was expecting Hawkeye to die but I was generally surprised and sad when they killed off Black Widow. I was really sad when they killed Iron Man. I knew they were but I didn’t know how they would kill him. It was incredibly satisfying to hear Iron Man say “I am Iron Man” one last time. His death is sad but satisfying. The funeral scene at the end of the film was so awesome and brought back some characters we haven’t seen for a long time. The action in this film is probably the best in the MCU. The climactic battle at the end is in my opinion the best action scene in all of cinema. Captain America wielding Mjolnir was so awesome to watch. Personally, I loved the ending for Captain America. He got to live the life he never lived. Overall, Avengers: Endgame is a satisfying conclusion to the first 22 films in the MCU while boosting a very strong cast, some amazing action, and an immensely satisfying conclusion. I give Avengers: Endgame a 9.5/10.",2019-06-17,8,12,12,0,English
484,NickGomesGuy,"Its Amazing the screenpaly, time travel theory and the culmination of the 11 years 22 films",2019-06-14,10,12,12,0,English
489,CoreGamer1408,"Fun action movie with some feels, but only a few laughs. Giving a crap about the central characters add points to this experience for sure. A fitting end for most of the characters. It was a darn shame how they handled Black Widow and Thor. Well this is the personal endgame for my interest entire Marvel franchise. It can only all go down hill from this point so I am out.",2019-09-26,8,11,11,0,English
490,Dragonfly02,Where have I been all this time?! This may be the best movie that I have ever seen!!!,2019-07-31,10,11,11,0,English
