,user,review,date,user_score,review_votes,review_upvotes,review_downvotes,language
257,crumbreon,"I was ready for anything walking into Endgame, and while the towering 3+ hour run time was daunting, and the seemingly insurmountable pressure to outperform Infinity War, I had reservations. The cold-open to the film impressed me. Normally, there is bravado, fireworks, showcasing; this was the Russo's cherry on top of the 11 years of cakes after all. The opening scene set the tone and reminded me of what was lost, and followed up with the plain text title card of the movie. I thought it was immaculate, much like a lot of the ""moments"" in this movie. One thing that cannot be overlooked is that this is very much a finale. It's tying up all the loose ends that need to get sealed off, and it's non-traditional in the sense that it is essentially a victory lap for most of these characters. So in that sense, this movie is not so much a ""movie"", rather than a series of ""moments"", and I'll explain a bit on that. Some of the most impactful scenes resonated with me even several hours after the movie ended. When Cap confidently picked up Mjolnir and joined Thor in beating the crap out of Thanos with his half-broken shield - the audience collectively and audibly gasped. When a broken Thor tearfully stumbled over himself trying to save his mother, and she (accepting her fate) tells him that it's not for her to know. Piper tearfully telling Tony that he gets to rest, after the life from him slips away, following his heroic Thanos-dusting snap from his own gauntlet. The theater was so silent and the emotion was visceral. I could go on and on, but there are simply so many good moments in this film, it's impossible to detail them all without spending 3+ hours talking about them. The ending of the movie was predictable, but very much appropriate. It was safe, and the perfect end for Tony and Cap. Though maybe not as gravitas impactful as some of the other moments in the movie, it did remind me something that the entire series of MCU movies has preached to us: It's the journey that matters, not the destination. Endgame was a symphony of incredible moments, each hero stood out and showed they belonged - and in a cast this large, an incredible feat! I won't be rushing back to the theater to watch this again, not because the movie was bad - but because it was so completely satisfying. Like a traditional home-cooked Thanksgiving dinner, this movie left me without room for dessert, and I think that is perfectly fine. The only criticism the film is guilty of is shoe-horning social narratives in. I would have preferred to see a more organic relationship develop between the female heroes, instead of just throwing in a gratuitous ""she's got help"" and then arbitrarily grouping literally every single female cast member together who have seemingly not even met each other before. It felt extremely cliche, extremely trite and out of place in a movie that went out of it's way to explain a lot of complexities and give solid reasoning behind all of it's other decisions. The only other faux pas I can flag on this film is removing the emotion from the final Thanos fight. Plucking a Thanos who hasn't even found a single Infinity stone from history and making him face our heroes who have literally been morally and physically beaten by him, felt lackluster. Seeing Scarlet Witch just pouring out raw emotion and to have it met with ""I don't even know who you are!"" while comedic, fell flat with me. Thanos only realized that he ""won"", by getting all of the stones and snapping away half of the universe. He had no knowledge of the sacrifice or pain he personally inflicted on every single person in this movie and that was one moment that we will never get to see. All in all, I thoroughly enjoyed the ride and I'm happy to see a true end to this fantastic series. It'll be difficult to rise to the heights of this again, and it's likely not something we will see again for another couple decades. So for now, enjoy the journey.",2019-04-27,8,37,25,12,English
258,jtwoodall,"It was really good...maybe great as superhero films go.  But, too damn long and absurd misuse of Thor and especially Hulk.  And arrow guy gets way to much screen time.  I mean, he shoots arrows for Christ's sake.  What good is that guy, really?",2019-05-08,8,40,27,13,English
259,amheretojudge,"Feige is done with his first arc and so are we, this is more a palette clenser than a tease, bring it more, it is simply ""old style"" good.Avengers: EndgameRusso Brothers docks the universe in one colossal stage where our mighty heroes dances the dance of their life, it is extremely well choreographed. Never has this ever pulled off at such scale, claims Marvel, and Feige proves it, by swooping in every last drop of blood shed in this war. But mind you, it is unlike Infinity War, it never gets too much. There is a certain amount of linearity in their narration that is more focused and polished than the previous installment. It is the ultimate heist, in a sense that it is as big an ambition as the cast is. And so is the storytelling, as rich as the banner goes, the usual baggage of levity that Marvel often failed to own it, comes in natural in here.Split into three acts, this wallop of emotional drama is not the tease for the game but the journey, that Robert Downey Jr. quotes to be proud of. The world of Russo Brothers, is perfectly balanced as Josh Brolin, wanted it to be. What could have been precarious is somehow its best asset, the film is obvious or even obliged to connect the dots. And as much as you feel overridden in this ride, it never grows dull; this overwhelming experience is plastered across the screen for three straight hours that is ought to make the fans giddy up for more.What has been fascinating, is to see, not Thanos turned into a mere pawn of the game, his malleable philosophy is still threatening to the leftover superheroes. Christopher Markus and Stephen McFeely, the screenwriters, are free from the stereotypical MCU formulaic structure, it doesn't tap on- a joke, an emotional punch and an actual punch- to the safe beat, they have deconstructed their rhythm for the Endgame, tears are expected, satisfaction; a surprise package.",2019-04-26,8,40,27,13,English
260,JoeDoesntCare,"It was just generally okay. It was going pretty well until about midway into the movie and then all of a sudden a bunch of plot holes start popping up all the way to the end. It's still a pretty decent movie, but I was really disappointed with the ending. They really ruined Thanos who was an amazing character in Infinity War and felt like a completely different character in this movie. I'm sure by now everyone knows they use time travel, and unfortunately as most films that use time travel it just didn't work out well. Without revealing too much, they could of made it work but they started digging  their own holes. Anyways, worth seeing but very meh. Doesn't come close to Infinity War.",2019-04-27,7,40,27,13,English
261,crazyboyybs,"I just couldn't stop crying in the end, it was everything that I was expecting and more, thank you so much Marvel for the perfect finale, and thank you so much for giving Scarlet Witch the powers and the perfect scene she deserved.",2019-04-27,10,40,27,13,English
262,RossDanbyGamer,Avengers: Endgame is my new favorite movie of all time! It is just amazing!,2019-04-28,10,40,27,13,English
263,TheServant,"In itself the movie is really good and the final is very satisfactory. However, the time travels and the fantasy that result with other realities, leaves many holes in the movie. Despite that, shutting down the brain won't be so hard after all, there are emotions and mixed feelings that mitigate the field of science fiction that the Avengers entered.",2019-05-03,8,40,27,13,English
264,drlowdon,"Essentially the second half of Avenger’s Infinity War Endgame is ten years, and countless movies, in the making and it doesn’t disappoint.You can pick holes in the plot if you really want to, and anyone jumping in now will be completely lost, but if you’ve been following the MCU over the last decade this not only offers great entertainment it also provides a fitting finale for a hugely popular group of characters.",2019-05-02,9,43,29,14,English
265,DukeJon,"The second best superhero movie I've see, after infinity war. Takes a while to get going, lots of false finishes and trips to the past, but overall a very fine send off for iron man and captain america. Three hours long, but the time flew by. Marvel are knocking it out of the park at the moment, I can't think of a better way to find escapism at the movies.",2019-05-11,8,43,29,14,English
266,Goo4you,"The movie that confirmed reviews and how earning mean next to nothing. If you've watched these movies over the years, you're going to see this or you already have. Do you know what doesn't matter? Everything else.Pro reviews citing cinematography or pacing; pointlessPacing issues? PointlessActing? PointlessThere is a 10 year 20+ film Plot and Story Arc coming to a close, nothing else mattered. You might as well tried describing the size of a fathomless void.With that said, great movie, tons of fan service, tons of callbacks. The movie was the perfect dessert to a wonderful 7-course meal.",2019-04-28,9,43,29,14,English
267,mrmonster,"Avengers: Endgame is truly an awesome movie. I saw it yesterday, and my body still hasn't fully recovered from both the shear epicness and the emotional impact of what I saw.",2019-04-28,9,43,29,14,English
268,CalvinCrack,"Masterpiece.  One of the best big movies ever made.  Ranks with the great sequels like Empire Strikes Back and Dark Knight. The script, the direction, the performances are all devoted to making this movie special.  Endgame could have been an 8/10 and made as much money as it has.  But the fact they delivered an 11/10 shows you what these filmmakers are made of.  When it ended I immediately wanted to see it again.",2019-05-04,10,43,29,14,English
269,alfredhess36,"Found myself having a big stupid grin on my face for a majority of this movie. No, it's not perfect, but it's good and at a time where many movies can't keep a plot coherent through two or three movies, they pulled off a decade long series tying 21 other movies together into one satisfying climax. I'd see all 3 hours of it again today.",2019-04-26,9,43,29,14,English
270,SaintJames012,"Most movies are lucky two have one memorable scene that sticks out and becomes the major moment of the movie. Endgame is blessed with being filled with them. A great ending to a story 11 years in the making, Endgame is only hindered by a few points that seem to hinder the overall pacing of the movie. Let's be honest, at this point we don't want to see exposition dumped, we want to see a bloodbath.",2019-04-30,9,43,29,14,English
271,SnipeOrigin,"For what it is, a decade long franchise, that killed many important characters in previous entry. They achived everything. It was very tense, the whole time though, it has comedy to losen that up, and great action.Lil' more action would be great.",2019-05-02,9,43,29,14,English
272,Gabo_397,"The movie overall is great, better than Inifnity War in my opinion although it's full of fan service and sometimes I thinks it's just a little too much going on...",2019-04-29,9,43,29,14,English
273,spongeswift,"Avengers Endgame is the most jaw dropping movie I have ever seen. Not only because of what unfolds but really because of how it unfolds. It's not only ambitious, it has so much heart that people that haven't even connected to these characters might shed a tear over their hardships. Tony Stark was great as always, the Hulk became as likeable as ever, Black Widow shocked me, and Captain America did good. I think a real standout is Captain Marvel though. Her power was so brute that it gave me goosebumps but her vulnerability shined through and made me emotionally involved with what she was doing. Thor though... Overall I thought this movie was really worth the decade wait.",2019-05-04,8,43,29,14,English
274,Digibutter64,"Avengers: Endgame starts off in a situation we don't often see in superhero movies; the heroes have lost. Thanos has successfully erased half of all life. When the Avengers discover that he has destroyed the Infinity Stones to prevent them from being used again, they eventually decide to do some time travel to get past versions of the stones in an attempt to revive everyone that disappeared.This is a film that rewards you if you've seen several past MCU films, with events of said films going on in the background as the Avengers and their allies search for the stones. The action's great, there are emotional stakes, and the humour generally hits. The directions taken with Banner/Hulk and Thor will probably rub some the wrong way, but this is ultimately a great conclusion to the ""Infinity Saga"". I can't wait to see where the MCU is taken next.",2019-05-05,8,43,29,14,English
275,vinio2323,"Endgame was a direct sequel movie to Infinity war. It had a well paced story with plenty of action and dialogue where for the number of characters the screen time didn't seem rushed for them. It was very satisfying in it's wrap up and story telling of a number of our heroes, and the overall plot was not quite what I expected throwing a lot of fun and twists into what you would expect with some great call outs to the comics.It was a great movie well worth the watch on the big screen. A few notes though. If you aren't a die hard in the MCU (Having seen every movie) that is fine, but there are a number that are almost necessary to have seen for this one. The First avenger movie, the original captain america and thor movies, the first guardians of the galaxy, and of course infinity war.",2019-04-29,9,43,29,14,English
276,jrr3,This is THE film to see in a theater!  I will enjoy watching it at home but I can't wait to see it again.  When the film ended I couldn't believe that 3 hours passed.  I really didn't see a lot of the plot coming before it happened.  That is the mark of a great script and creative writing.  The acting was very good too.  You could probably count on one hand the characters in Marvel that weren't in this film!  HIGHLY RECOMMENDED !!!,2019-05-06,10,43,29,14,English
278,miccael,"critics can go f themselves. this was great movie. amazing. Sure some things i would have done differently but yes, this is 10/10 movie",2019-04-26,9,43,29,14,English
279,alejandro970,"At least, the epic ending of a saga that catch the attention of a generation. Mixed elements of action and comedy gives enough dynamic the full 3 hours, with a crushing melancholic final act. ¿What's next?",2019-05-12,9,43,29,14,English
280,Cereal-Killer,Most of the plot is predictable but there are lots of surprises and it´s the most epic MCU movie so far. Maybe even the most epic Superhero movie of all time.,2019-04-26,9,43,29,14,English
281,neefman,"I didn't even bother to try to control myself and cheered out loud several times.  It felt great to be a kid again for 3 hours, and that's why the MCU movies are so much fun.  I'm seeing this again soon while it's still on the big screen.",2019-04-28,9,43,29,14,English
282,GandalfTheGamer,"It could've easily been a 10/10 but there are times that movie asks you to just role with some of the plotlines while they don't really make sense. they took an odd approach with one character in particular (whom I wont Spoil) that at the end was pointless and felt like forced comedy. the fact that Captain Marvel was SO ridiculously OVERPOWERED was a turn off for me but the plus side is that she's only in it for like 5 minutes. Avengers Endgame is one of those movies that you can nitpick the crap out of it but all the nitpicks only cost it a single point, the movie is simply spectacular! It is the best finally for this chapter of MCU that I could've hoped for. The CGI the fight scenes the score, acting, character arcs, EVERYTHING (other than those nitpicks) is AMAZING about this movie! oh, btw you're gonna cry your eyes out...",2019-04-27,9,43,29,14,English
283,MallRat15,"The Perfect end to an amazing film franchise. Movies tied everything up perfectly and left the fans satisfied with the outcome. Despite its 3 hour run time I never found myself bored and when the end credits rolled felt it could have been longer no problem. Stand Out performances from many of the original Avengers, along with great performances by everybody else. Thanos is one of the best villains of all time and does not disappoint to watch.",2019-04-30,9,43,29,14,English
284,NothingReviews,"Don't let that 8 scare you, Avengers: Endgame is by far the most ambitious film of all time and a very important film as no other films cannot create such a big franchise.Endgame is funny, depressing, satisfying and very enjoyable and everyone gave their all (for one) in this film as some actor/actress will probably never return for the MCU after this film. There were a lot of easter eggs from this movie which links to the other films in this universal which was awesome to hear especially at the end. Everyone has a good reason why they make these decisions and doesn't leave the viewer confused. Overall, the action scenes were satisfying and awesome, the ending was a great conclusion to this movie and just in general, this was (almost) the perfect marvel movie and it's definitely worth your 3 hours of lifeThe reason I said almost is because of these reasons:1. Captain Marvel was barely in the movie, they made an entire movie about her and yet you didn't really need to watch it for Endgame as she's rarely in it and she was in the climax of the movie. Plus Brie Larson was horrible in this film and I know that she is a fantastic actress which disappoints me even further2. The movie is funny. Maybe too funny. There are so many emotional scenes in this film but then they quack a few jokes in there which sure they're funny but it destroys the flow of some tear-jerker moments3. Speaking of the flow, when they finish a dark, miserable scene, they immediately go to a bright, happy scene which just confuses me. Why could they just slowly tune down the darker scene and slowly build up into a relatively happy scene?    However, with all the negatives, I will probably rewatch this movie again",2019-04-27,8,43,29,14,English
285,JeromeRiggs,"Avengers: Endgame can be best described by comparing Avengers: Infinity War and Avengers: Endgame to Guardians of the Galaxy and Guardians of the Galaxy Vol. 2 respectively. The first one is an epic and weird adventure that has both the wacky superhero stuff and great action adventure stuff, and the second is emotional, more character driven and incredibly satisfying but with more wacky superhero and action adventure stuff. With that in mind, Avengers: Endgame ties up the MCU up to this point pretty nicely. It is a love letter to all the other MCU movies, if it was written by a love-letter-writing professional heartthrob.",2019-05-15,9,43,29,14,English
286,Darkvenom39,Now this is how you do a movie !!!! This is the BEST movie for me of all time and the whole avengers series of movies is my favorite and num 1 spot in my heart for the best movies of all time and ever !!! The team and actors are so talented one by one ! And im sad that this ends but at least it ended well with a happy ending !!! Overall RIP Stan Lee youre in my and fans hearts without you these glorious movies and comics wouldnt of ever existed i respect you and the avengers crew and love you guys more than 3000!!!,2019-05-05,10,43,29,14,English
287,xcxvy,"I must admit that Infinity War left me with twisted feeling, somehow there was too many action and no real character development. Cap had nothing to say and Bucky said one sentence. So I was sceptical with Endgame, but it managed to overwhelm me, and my god it has delivered the conclusion I was waiting for. My favourite movie ever :)",2019-05-24,10,43,29,14,English
288,GrantD243,"I believe that this is Marvel's best film by far. It was everything I had hoped for and then some. It wraps up some storylines, renews some others, and sets up the next phase of the MCU very well. Also, this is one of the few three hour films I've ever watched that maintained my interest the entire runtime.",2019-05-12,9,43,29,14,English
289,clarkaddison,It may not be the ending you specifically wanted but it`s the ending the MCU deserves. Apart from some unexplained plot points and some minor complaints this film does the impossible. It brought an end to the current run of MCU films. There is still more Marvel to come obviously but seeing the end of the Infinity Saga was very rewarding.,2019-05-04,9,43,29,14,English
290,ssesses,"An utterly fantastic and surprising movie. The pacing was fantastic, and the movie goes into a completely unexpected territory, that allows for a bit of fan service and one of the best movie sequences in film history. The years of build up allows for a strong connection to the characters, and Endgame takes full advantage of that.",2019-04-28,9,43,29,14,English
291,ahmedaiman1999,"The Russos couldn't have subverted our expectations in a better way. Simply, because they didn't give a hoot about our expectations. Instead, they gave us a a continuation of Infinity War with a most unexpected conflict. In other words, they went for the head; all we cared about are the stones.They also proved that they understand every character in this universe better than anyone. They delved into their minds and hearts in a way fans ever hoped and fancied. They truly fleshed out our beloved avengers by showing them as more humans exactly as we felt about them at every important moment in every movie in the MCU. They convinced us that these characters really experienced these moments, and thus cared about them as much as we do. The incredible cast, who are at the top of their game, couldn't have complemented what the Russos did for their characters more perfectly.Whilst the unique storytelling of Infinity War never feels ""cinematic"", I absolutely loved it with its epic quality and how I felt that I was flipping pages of a graphic novel instead of watching a movie. The Russos used once again the same exceptional style of narration here, except that, to my surprise, it feels as ""cinematic"" as it gets! I have absolutely no clue how they have managed to do such a thing, but what I know is that this made me realize that Infinity War is flawed, especially in this aspect, way more than I thought. Everything here works twice as good as it did in Infinity War ــــ comedy and drama. Also, this made the fast pacing don't come at the expense of the cohesiveness of the story.The movie did make it a bit easy for itself sometimes (and we can see that in certain decisions that some character took, and a couple of things that are quite perfunctory that they could have gone deeper with), but the movie also took three thousand risks that entangled itself in what could have an endless loop of nonsensical chaos only to serve the franchise's fans, and it did as good as it gets.(9/10)",2019-05-12,9,43,29,14,English
292,Sam11,"As a conclusion to so many movies Avengers Endgame hits hard with the nostalgia, really good fan service, epic fight scenes, a good story which is not non-stop action and heartfelt ending. My main problem with the movie was sometimes the humor which for the most part lands but sometimes does not and can be out of place in certain situations. Some nitpicks can be said about some technical or scientifical things but this is a movie with a walking, talking, sentient tree and racoon  so those are minor issues for me. This movie has minor flaws but still the good parts of this movie outweigh the bad parts by a mile.",2019-04-26,9,43,29,14,English
