,user,review,date,user_score,review_votes,review_upvotes,review_downvotes,language
875,Stigmar,"I promised never to go on Marvel movies after awful Age of Ultron, and other movies were pretty average to say at least. But sometimes, like in case of Civil War and Infinity War they were pretty good. So I expected from Endgame the same - that it will be a ""good"" Marvel movie. But oh my god... It was just horrible. I will not include spoilers here, but I will say one thing - writers should abandon idea to include time travels in the movies. It doesn't solve anything, but creates just enormous plot holes. Nuff said. 3/10, just for visual.",2019-04-27,3,54,10,44,English
876,Guerrierogd,"The movie starts off fine untill the time travel **** , seriously , 5 years after the snap Antman arrives and says to go and make a time travel machine ( without any project or relevant idea ) and everyone acts like no one ever thought of that before , Stark than proceed to develop it overnight . Seriously , a 14 years old could have written a more plausible plot. Skip over a pretty useless middle section of the film and then in the final battle Thanos challenge all the avengers + the 5 infinity stones  , basically alone + his army .Stark can develop in one day a time travel machine but can't decide to use only 1 stone to kill Thanos , instead uses all 5 for no reason at all and suicide . ( Anyway it's not possible that hulk used the power of the 5 gems to resurrect half of the universe and recives almost the same ammount of damage that Iron man get to win a battle killing AT MAX a couple of million of beings xd ) . I expected a lot better writing . You can find a better plot in h*ntai",2019-04-26,5,54,10,44,English
877,Dodger,"In short not as good as infinity war.Cons:There is a bit of the new disney ""SJW"" signalling going on this this movie, one scene in particular beats you over the head with ""Woman power"" completely taking you out of the moment.Scenes that should naturaly of been sad or epic were massivly overwrought to the extent that they were basicly telling you what you should be feeling, rather than generating the emotion itself.The ""big"" action scene was hugely overdone, way too many charatcers for one scene which left it feeling like a Transformers battle where you cant quite tell whats happening.The third act was substantialy worse than the first two.The storyline was laughable compared to infinity war, with fairly massive plot holes and logic leaps.Thanos lost everything that made him an interesting villain.Pros:Some good use of comedy in the first and second actSome of the visuals were very goodSome memorable scenes, especialy during the ""dopelganger"" scenes.Good time travelling mechanics.Suprising movie opening.Overall its a definite watch if your a fan of the series, just dont get your expectations up to high as this wouldnt even rank in my top 5 Marvel films.",2019-04-27,6,49,9,40,English
879,Smarten9000,Boring no good humor they f*cked up Thor by being so funny to make him fat hahaha,2019-05-30,1,33,6,27,English
880,mauvemage,"Wow, what a bloated disappointing mess of a finale. At 3 hours this is a boring and tedious film with phony drama and several humour miss-fires. A fat Thor gag is absurdly over done and sums up how tired and cynical this toy commercial is. Worst of all, the end is a re-run of the last film and I could only recommend this failure to the under 12's. If you liked Transformers, you'll like this.",2019-04-27,4,50,9,41,English
881,leorullo,"I can't give more than 6 to this film that is nothing compared to Infinity War. 3 hours are too many and the beginning of this film is so slow,here is the reason of the 3 hours. I didn't like Thor at all because for me that's not the real Thor.About Professor Hulk I can say that I wanted more insights of the character which is not well studied.The only part of this film that I liked was the end, the final battle, ""AVENGERS ASSEMBLE!""",2019-04-27,6,50,9,41,English
882,Sv4roG,The movie is OK. There's couple of characters and scenes that seem little bit or a lot(most people probably know what i mean)out of place and unnecessary. First Avengers movie was much better but this one is fun too.,2019-04-28,6,45,8,37,English
883,Max_Ro,"I I am very upset. They killed Our Marvel Heros because they didn't want a happy ending? Seriously? It's a movie, I don't go to the movies to cry I go to leave my reality and enter a dream world were everything is perfect, especially our Marvel characters. They had a da m time stone. Reverse time and bring everyone back alive, end of story!I hate that Captain Marvel didn't save the day like she was supposed too. I hate that they women had a small part in this movie and I'm not a feminist. They made it an Iron Man and Captain America movie. Then nobody could take down Thanos? Come man, you use his weaknesses to take him down.The reason people ran to see this movie because they wanted to see what happens.I'm very disappointed. I felt like this was rushed to make a dime off of hard core fans. I gave it two stars because the war at the end was the best part!The End!",2019-04-29,1,57,10,47,English
884,javaprof,most overrated film of 2019.This film is to boring why all the new super hero films has same scenario?,2019-04-27,0,63,11,52,English
885,charles19,"One of the most artless movies I have ever experienced. Movie audiences are becoming more and more (numb, tolerant, enured) to mindless Hollywood spectacles like this, and unfortunately now so are the critics. If this is a standard for movie making, heaven help the movie industry. I can't help but compare it to Game of Thrones (last season not withstanding), and it fails miserably across all standards of comparison. I had absolutely no empathy for any of the characters, except maybe a bit for the bad guy (what was his name.. Thanos?) who seemed weary and forlorn. If you are 15 years old and liked this movie you can be excused for your taste. Otherwise, I think you are probably settling for some really lowbrow Hollywood bird-doodle.",2019-05-17,2,46,8,38,English
886,WeAreVenom87,"Crazy disappointing is probably the best way I can describe this movie. I feel like giving it a 2, but to be fair a 6 is probably what it deserves. The reason I feel like giving this movie such a low score is because it was so hyped for so long building anticipation and then totally mailing it in. I admit I am a huge comic book fan and because of this I have seen every MCU movies with the exception of only making it about 75% of the way through Captain Marvel. I have become much more lenient on expecting movies to follow comic book plots and even encouraged change if I thought it was for the better. In this case they had a perfect example to adapt from in Jim Starlin's Infinity Gauntlet series. I already knew from the first part IW and due to contractual obligations these movies would be much different from the comics, but I was not expecting this. This movie throws away all the awesome scenes from the comic to replace them with lame callbacks to old movies, dragging characters through the mud like Thor and Hulk and setting things up for the ANAD Marvel characters in the future which are the worst of all the comic characters (Thanks Disney). The time travel plot was lame poorly executed and riddled this thing with plot holes. Most of the movie was boring and I felt no emotional investment. Characters I have loved fro more than 20 years died or had their final big moments in this film and I felt nothing because it was so poorly executed. I am not arrogant enough as a comic book fan to say I will never watch another MCU movie again with some of my favorite characters like Doctor Doom and the X-men joining, but I plan on skipping a lot of these until they prove to me they have their **** together.",2019-04-30,6,46,8,38,English
887,Zisis151,"First of all, let me state the fact that whoever embraces time travel in movie/TV/video game plots, needs to up his standards. It is one of the laziest and most uninspiring attempts to create stories around and usually ends up in not making any sense (just like in this movie).As for the film itself, it started great by showing everyone's pain and anger towards Thanos, but from the moment that mouse(lol) happens to press a button and create this whole ""time travel"" plot, everything goes to absolute **** And it's not just the time traveling, it's also the disrespect shown to characters like The Hulk and Thor, as well as the Shonen anime type of ass pulls like Captain America fighting with Thor's hammer and summoning lightnings from the sky. Moving on to Thanos.. He was there, but he wasn't really. The villain that Infinity War built is not there and even worse, he goes out of character claiming to destroy the Universe and how he will enjoy torturing Earth. Last but not least, the typical feministic cringy bull****.. Captain Marvel has the gauntless and the only ones running to protect her are the female Avengers? All my **** lolz at that scene.This movie took a huge **** on what Infinity War had built and scrapped everything that made it great. Sadly, we live in an age where people have low standards and get manipulated by heavy marketing so I expect this movie to be considered a ""success"".",2019-05-04,0,52,9,43,English
888,Ahew,"I was somewhat disappointed with Endgame. Following on from the epic that was Infinity war; which coupled action sequences with emotive dramatic scenes, the time-travel arcs in Endgame were peppered with too much slapstick-esque comedy and a lot of unnecessary fan service scenes.",2019-04-26,5,52,9,43,English
889,simevo1979,"After being such an avid fan of these (mostly) marvellous films for so long, it's such a shame to have it ended this way.  It still entertained (mostly) but i think that hinged entirely on the fact that i've liked these characters in other movies - and by the time of the very hastily put together 'final battle' which i thought was filled with CGI near-misses - i'd checked out.",2019-04-26,4,58,10,48,English
890,LiamHonest,"This movie is utter garbage... Timetravel ""This is not some back to the future bs"" - True, Back to the future was a masterpiece... This movie is just overrated and totally trash. I am a marvel series fan, but Endgame did everything wrong... 3 hours garbage. No plot convenience , no action... Without spoiling, that movie is horrible... Just boring and some of the worst and unsatisfying movies I have watched in years... Superstar cast... Boring predictable garbage...",2019-05-01,0,47,8,39,English
891,Jcondic,"Avengers Endgame feels like a movie where Marvel is patting itself on the back, good job! I don’t think there’s been a Marvel movie that has disappointed me more than this one. Last year’s Infinity War was great, everything was put together after ten years and it had a fantastic ending, a cliffhanger that had us all wanting more. The dramatic ending in infinity war is completely thrown away. Like my god, every real dramatic moment that was happening in Endgame was thrown away with humor. Literally would it be so bad for people to just be miserable, they toss in these stupid one liner’s in every scene, maybe its just me and I find it forced and not funny, but the obnoxious woman sitting behind me was cackling throughout. But really 5 years into the future the Hulk would still be dabbing? Really? Are people even dabbing now anymore? Captain America admiring his butt, Thor with anything he said, and Black Widow staring into the distance trying to cry for Clint while holding back a smile. Humor shouldn’t be used to take viewers out of uncomfortable situations, what’s the point of a dangerous battle for a viewer when they are constantly molded to feel safe with some joke to kill the seriousness. Let’s talk feminism and the pat on the back. During the big fight scene, they took time out to have all the woman stand together to fight Thanos, I couldn’t help but roll my eyes. Really? That’s showing how progressive marvel is, that shot is an insult considering only one of those women has been a lead in her own film. Marvel pat yourself on the back again, yay Girl Power and your trailblazing feminism.  That moment could’ve been so much better had they fought him and showcased their strengths, showing woman are equally good fighters to their male counterparts. Captain Marvel is one of the strongest super heroes in the whole MCU and she was probably on screen for ten minutes of the 3-hour runtime. But to literally have them come together during this massive fight for that shot is lazy filmmaking. I want one person to tell me they weren’t taken out of the film to consider all the woman were standing together. It killed the momentum in the battle. Risk and reward, Marvel/Disney usually doesn’t do well in this area. Star Wars Episode 8 was fantastic because things were at stake and viewers weren’t just given what they wanted, look at all the complaint they received for it. I really feel episode 9 will be like Endgame in that it gives viewers everything with little to no surprises. Endgame plays everything safe, even when situations are risky they are still safe. You know everything will turn out fine. Yes, there are a few deaths but nothing we weren’t expecting going in. And most of the deaths have already been reversed. Black Widow gets her own series on Disney+. The Characters, in the ten plus years and twenty plus movies, how many characters can you say have grown? Have changed with everything that has happened to them? No character has really felt or dealt with the fallout of anything that has happened to them in previous films. If they have it was for a short period of time because on the other side of the fallout the characters are right back where they started. On a side note with infinity war they finally made Thor cool. With this movie they took ten steps back and made him a dislikable character.I’ve always felt that superhero movies are only as good as their villains. (ex. Dark Knight, Spider man Homecoming) Infinity War made Thanos a great adversary with depth, he had purpose. Endgame made him a caricature of a villain we will forgot about after the credit’s role. That ending and another example of dumbing it down for audiences. The perfect ending would’ve been Steve Rogers going back in time and sitting on the park bench as an old man. Boom! there you go; the audience is smart enough to figure out what happened. Instead they drag the film for some talk between Cap and Falcon. Then they cut to show you where other characters are at and that everything will be okay. Everything is spelled out for the viewers so don’t fret we’re all in a happy place. Like my previous paragraph no one seemed to be affected by everything that happened. I could be wrong, but I guess we will see when the next phase of movies starts rolling out. Now don’t get me wrong there are moments and scenes in this movie I enjoyed. The time travel to the 70s with Cap and Iron man was great. It’s not all bad but the things I dislike are overshadowing the things I liked.The more days I sit with this film the more I dislike it and the hype machine it has become. There’s no substance to anything in this film. When I see people saying this should get nominated for an Oscar, I want people to ponder if they’ll remember anything about this movie in 10 years or even 1 year. In closing here’s one more pat on the back, congrats to the people at Marvel/Disney.",2019-05-07,3,47,8,39,English
892,iceman994,First of all the story is really boring. There are many scenes where u fallasleep. Also ironman and nebula rescue part is so weird and too fast and not explained well like they were in a hurry to make a short scene that they have been saved by Cpt Marvel. Really badly designed scene. Also no view about the civillians how they feel about their lost friends or families. Nothing we get only view from the avengers and only Earth. Another thing is that where Scott comes out from the quantum realm becuz this scene so fast and really not explained in any way. I know its a 3 hours long movie but sometimes if u cut the boring parts and replace with important part them everything will be okay. So the time travelling is a thing in many movies to fix a movie becuz the directors stupid to make a good movie. Now they split up to 3 groups to get the stones from the past but the biggest joke is they didnt try to get all from one time like before thanos snap. Thanos against thor surprise is really strong becuz he can kill Thanos. Why not travel back cut his arm and take the stones go back and thats all. But they choose the worst part to get the stones from the wrpng and complicated way. Also Thanos wasnt that great villain and the story badly explained about him the comics were way mich better than this idea. They used the bad time travel idea to kill Romanov. Also they use the stones in the end to kill tony stark. When Captain Marvel get the stones and able to snap and kill the villain but not she has a too stupid character. Also this movie killed 3 main characters to give it to the next generation and Captain Marvel character was so bad before and she will ruin the MCU and the others not enough good. Sorry Marvel thats not enough to be worthy like the comics. We got some villains and needed to kill 3 characters read the comics and checkout how many villains are there. Many acting were so bad sometimes they are forced ina scene to be there but totally not exist there.,2019-04-26,0,83,14,69,English
893,donald_s,"This is a hard review to write.  On the one hand Endgame has a number of exciting and unexpected scenes.  But I have never in my life been more disappointed with a movie.  First it's a full hour too long.  Lots of slow pacing trying to establish relationships that either were or should have been established 5 movies ago.  But the real problem with the film is it's inability to get you to suspend your disbelief.  Speculative fiction, science fiction and fantasy are anchored on a single idea.  There may be something fantastic, but it's internally consistent.  If I have a magic broom that lets me fly, it can't suddenly in the middle of story develop the ability to make pop tarts.  If it does, anything becomes possible and the story has no point.  Endgame is riddled with internal inconsistencies.  Because of that, suspending my disbelief became impossible.  Good acting, good special effects and a really poor script.",2019-04-30,3,54,9,45,English
894,Kingdong71,"Walked out after the pathetic anti Trump comment! I'm in the UK and don't care who is this president of the USA but what I do understand is respect. There is no room for more childish behaviour from Hollywood. They have the opportunity to to take the moral highground but this just leaves a bad taste in your mouth. The Avengers franchise has been tarnished by such a cheap, childish stunt.",2019-05-04,1,54,9,45,English
895,ChrnoTodd,"This movie was a huge disappointment. A mix of plot holes, inconsistencies, paradoxes and logic defying rules of time travel.",2019-05-10,0,42,7,35,English
896,morrelliot7,"Hulk's arc = completed off camera. Thor's ark = we undo the work of the last 3 Thor movies and infinity war. Iron Man's arc = emotional but predictable. Captain America's arc = completely out-of-character and selfish. Black Widow's arc = emotional and powerful, but it was a poor sendoff for a great character. Hawkeye's arc = his Ronan plot was underdeveloped and seemed a bit pointless, but overall his was the most consistent arc of the movie aside from Black Widow's. Overall, this movie was a huge fail, and makes me not want to watch the old films since their plots mean nothing after Endgame destroys them.",2019-05-02,0,42,7,35,English
898,kirkender,"Endgame is an astounding achievement of capitalism. I feel bad for all the animators who aren't unionized and don't see any profits from this monstrosity. Because seriously, without the animators this movie is simple and ineffective.",2019-06-25,5,18,3,15,English
899,GWF1987,"11 years and 20+ movies and it all builds up to a meh of a movie.It was average. The good parts were good, the bad parts were really, really badJokes were excessive in what should have been a dark film.Ant-man coming back after 5 years shows Marvel Studios don't even care about their own continuity. If 5 years in real life is only 5 hours in the Quantum Realm why was Janet old in Ant-man and the Wasp? People still mock the Martha scene from BvS but let's be honest, the ""Cap freezes up and stops fighting when someone mentions Bucky"" nonsense is way worse than the Martha scene. It's used AGAIN in this one. It's ridiculous.They borrow from Dragon Ball Z for how time travel works, that way they can mess with time with no repercussions.Widow's death was emotional manipulation, and ultimately felt forgettable after the fact. Tony's death was the only really good part of the movie because it felt like the right way to end it, especially knowing how the MCu started with Tony being a selfish playboy.Steve somehow can go back in time and live out his life and be old in the present, with no changes to the current timeline? It's so stupid. And he gives the Shield to Falcon? Ugh. They really are going full SJW with future movies, aren't they? Forgettable movie. It was average at best and as usual the critics show how biased they truly are where they call this movie ""Once in a generation"" when it's just another MCU movie that is meh at best. Rotten Tomatoes also shows the bias used to protect the scores of MCU movies (not just them deleting negative audience ratings for Captain Marvel but legit critic score they manipulate). One critic gave the film a 2/5 but their review was labelled as ""Fresh"". Mind you, a 2.5 for BvS was considered ""Rotten"". Amazing how that works, isn't it? How a 2/5 is Fresh but a higher rating is somehow rotten for a non-Disney comic movie? But there's no bias (sarcasm)They further ruin Hulk and Thor, and seeing Hulk dab had me ready to walk out of the theater. I gave this a higher score intially but remembering the dab brought my score down from a 4 to a 3Seeing Captain Marvel easily destroying a full powered Thanos and shrugging off his blow like it was nothing shows how big of a Mary Sue she's really going to be in future films. And I honestly believe before hey did a bunch of reshoots a few months ago she beat Thanos and saved the day, and after seeing reaction to her character and Larson's comments against a large chunk of their potential audience they changed it to Tony stopping Thanos with the stones to keep from alienating more of their fans with that shoehorned in character.This should have been the end of the MCU. But the franchise prints money because of people like the guy who made headlines for seeing Captain Marvel 116 times and the guy last year who saw Infinity War over 100 times in theaters. So bad to average movies will continue to dominate box offices, prompting other studios to follow suit, meaning the days of good filmmaking will continue to fade into memory",2019-04-27,3,61,10,51,English
