,user,review,date,user_score,review_votes,review_upvotes,review_downvotes,language
2,Ztheman80,Phenomenal ending to a great 20 year franchise. Thor is still my absolute favorite.,2019-05-17,10,45,40,5,English
3,heysniccker,No spoilers!This movie blew me away!Its like an emotional rollercoaster from beginning to end. It also manages to be one of the funniest and quick witted MCU movies. The audience applauded when the movie ended.It is a must watch!,2019-04-26,10,50,44,6,English
4,Lilydemarch,A good concusion to a mind blowing series of movies. I'm happy with how everything turned out even though I'm dissapointed with the character treatment of Thor and Hulk. An epic conclusion.,2019-05-25,8,48,42,6,English
5,artardmoshea,"The things that I didn't like about Infinity War are alive and well in Endgame.Too much mindless action, not enough good story.Too many characters and none of them had any presence.I spent the whole movie waiting for the Stan Lee cameo and all I got was a Marc Maron flyby.As an old school comic reader, the power levels of most of the heroes in this movie are really annoying.Middle of the pack as far as Marvel movies are concerned.",2019-04-27,7,23,20,3,English
8,Olanamka,"It is one of the best movies I've ever seen! Emotional, unpredictable, amazing... All the theories turned out to be wrong; they made it a complete surprise.",2019-04-28,10,41,35,6,English
9,DeviMon1,"Go ahead and watch the trailers for Avengers: Endgame, they won't give anything major away. It's amazing for a huge movie to be so self-aware of itself, as well as, the movie genres that they're overtly borrowing from. The minor characters or those not even in Avengers: Infinity War, step up and help set up huge sequences that are highly entertaining and actually answer questions. Avengers: Endgame acknowledges every aspect of the characters emotions in their previous MCU film's and succeeds in the most Meta way possible.Ant-Man is a major reason for this. It's no spoiler to say that he's in the film as he produces some of the biggest laughs from the trailer of him ringing the bell at the Avenger's front gate. It's Paul Rudd's wry jokes, quick timing and fish out of water facial expressions that really assist things.The pacing of Avengers: Endgame is amazing and not for the reasons you might think. It's brilliantly paced, but it throws the entire formula and how MCU films are done on their head. Battle, loss, battle, loss, humor and then victory, take those ingredients, shake well and you've got a loose description of some average superhero films.If Avengers: Infinity War left you feeling betrayed and bummed out, I feel you. Avengers: Endgame more than makes up for any ill feelings that it caused. I see why they played it the way they did, and doing so any other way would've cheapened the film, watered down the MCU and made it all disposable. It is also worth noting that the film balance lots of humor with the drama, all the while putting it in a nice bow with stones.What we're left with is a 10 year opus that spans more arcs than Lord of the Rings and encapsulates it all in a perfect manner. Granted, they will still make many MCU films, this is not their swan song. However, there is a victory lap feeling about Avengers: Endgame. It respects the fans, adds to the dramatic elements, answers questions that fans have wondered about and plants a couple new seeds to grow on.",2019-04-26,10,54,46,8,English
10,bkristman,"A very mixed bag of good ,bad and meh. They actually could have split this episode into 2 parts and it would have been better because they tried to jam way too much exposition,wrapping up of loose ends and results for all characters into 'only' 3 hours.That didn't leave any time for most characters to be anything more than devices to move the plot along.The last hour makes the price of admission worth it though as a lot happens.Anyone worried about Captain Marvel taking over the film as dominant figure rest easy .It's not that way. Still worth an 8.",2019-04-26,8,54,46,8,English
11,Threnodist,"About the all female scene: as a straight guy, I like that scene. I have seen so many negative comments about it and state the scene is so ""forced"". Well, if we use this mindset, the whole movie is ""forced"" because so many things had to happen at the right place and right time: Tony Stark meeting his father, Steve Rogers getting back with his love of life. Also, if Hulk, Iron Man, Captain America, Thor, Hawkeye, Star Lord, Black Panther and Dr. Strange are fighting together in one scene, I don't think people would say it's ""forced"" although they are all males. Last but not least, this whole movie is a fan service. Let's just celebrate the diversity of the superhero lineup. Everyone of them is the favorite for some fans. You don't need to bash others to love one. Thank you!",2019-05-02,8,31,26,5,English
13,mr_ahs,A fantastic movie without a malfunction and the peak of all 22 Marvel films,2019-05-16,10,44,36,8,English
14,Jaredc324,"Endgame kicks off with an invigorating prologue (making you believe you are in for the Avengers ride of your life), but then swiftly drags and trudges its way through time-travel confusion. While it's ""greatest hits"" venture lives up to it's sentimental sendoff, it was just eye-winking filler to get to it's grand, over-the-top finale, that offers more than enough eye-candy to be satisfied. But its the final moments that truly give this series it's hoorah that it deserves. And they make you weep, even if you never cared.",2019-05-06,7,19,15,4,English
15,Samir17Sehgal,"In order to fully appreciate this heart warming and tear jerking 3 hour epic, I'd recommend rewatching all the other dozen or so Marvel feature films! Truly mind-blowing special effects and excellent acting, in particular from Robert Downey Jr, RIP, however slightly undermined by forced upon Identity Politics and a be-muddled and confused plot, with the excessive use of time travel not helping to ease more casual viewers into a wider experience. All in all, a good movie and a satisfying ending.",2019-05-04,7,23,18,5,English
16,CerysJarman,"Amazing end to such a long journey. It completely captured how it was Tony's world all along; with a satisfying ending that tied up the loose ends that we original Marvel fans have been wanting to see for a long time. And while there were moments that could be called ""fan service"" it was exactly what we needed after such a long time getting here, It was bittersweet.",2019-04-27,10,41,32,9,English
17,FERNAN,It's the best movie i ever seen in my life. Wow!!! Congrats to th Russo's. I hope it's not the last one.,2019-05-25,10,40,31,9,English
18,tremault,"I would have given it a 9 or a 10 if it were not for the feminist agenda. There were plenty of scenes showing strong capable women throughout the film and I loved them. what I did not love, was the power puff girls scene at the end.",2019-05-05,8,22,17,5,English
19,bfoore90,"Endgame was a frustrating film for me to review, Because on one hand I was mindblown by the sheer force of this film. While, it is a satisfying conclusion to the stories of Iron-Man, Captain America and a few others; you can't help but get confused by the convoluted and overthought time-heist middle of the film. It's not as good as Infinity Wars it still provides a ton of emotionally satisfying moments that should please longtime fans of the series.",2019-04-26,8,47,36,11,English
20,ron0001,"I have to say this movie just blew me away, every aspect of it, the character arc that the entire cast go through especially Thor, Tony and Steve the world post snap and of course a 3rd act that just was a comic book come to life in all of it's glory. For me this is a masterpiece and one that I will treasure forever and I'm great-full for everyone in marvel who help made this piece. Best comic book movie of all time in my humble opinion, just a must watch for every fan.",2019-04-29,10,51,39,12,English
21,roastbird,"All right, movie itself.It's not bad, but it's not excellent.Infinity war is better.Pro:Fan service, Great CGI,Iron manCon:Whatever you complained in Batman vs Superman and SJW star wars.this movie has them.And that's why people are giving ""0""s.I also took one points off because the reference to ""back to future"", it's very disrespectful,Just like what they did in Star Wars.Man, I can't believe ten year has passed. I don't think there will be another iron man in my life time.Thanks Robert Downey Jr. :D",2019-04-27,7,21,16,5,English
22,thefakepierre,"This is one of the best MCU films. On 2nd showing, now I see a couple of plot holes, questionable moments and an awkward moment.",2019-04-26,9,21,16,5,English
23,VultuRex,"Best Marvel film, so emotional, electrifying, so much heartthrob, and definitely worth the three hours",2019-04-26,10,277,210,67,English
24,Jes1310,"Endgame – delivers!  And that is an amazing feat. With more than 50 (!!!) Hollywood stars in one movie and a playing time in the region of 3 hours. This is not your standard superhero flick, no Endgame is more about loss, love, relations, family and just appreciating what you have.I absolutely loved all the funny references to other Marvel movies, and the jokes regarding time travel are hilarious. There are countless references and my favorite is the Coen reference to Thors new appearance.A worthy finale to a journey more than 10 years in the making.Must see if you like Marvel.",2019-05-10,9,46,34,12,English
25,funkytastikk,"slightly disappointing end to the avengers saga. It only kept you on the edge but never got you to jump. personally i felt it lacked action scenes for example, hulk never got to fight thanos and captain marvel came towards the end only. yes i understand there was going to be certain number of dialogue to be made to complete the story but still, as an ending and a 3 hour movie i felt the content should have been more. the movie focused too much on the feels and not so much on the works. in the end its a decent ending but still felt it could have been pushed more.7.5-8/10",2019-04-26,7,23,17,6,English
26,Moish,"It is good closure for this saga of 22 films a great homage to Iron Man and Robert Downey Jr. that started this whole thing up, a well managed to a certain point plot about time travel that has its plot holes without which you couldn't justify more than one event in the movie, the most commonly complained aspects I've watched are Professor Hulk, fat Thor and the scene of just superheroines, and they're not bad those have a justification among some other things like several deus ex machinas, the third act is super epic and it's fan service well done not like Batman V Superman where is poorly executed but it is not enough for me to be a better movie in general than Infinity War. More than the plot holes or the ridiculousness of the jokes what I disliked the most was how impertinent they were with the product placement, a commercial for Fortnite, a commercial for Axe and the most brazen of all the Audi one, its clear they gave more priority to other things that make it a coherent film with cinematographic arguments.",2019-05-08,8,42,31,11,English
27,Etilias,"You've seen it, you know its perfect. Best Marvel movie to date and an amazing conclusion to the Infinity saga.",2019-05-25,10,38,28,10,English
29,ShaqDaddy,"This was probably one of, if not the best, marvel movie I have ever seen. It was both exciting and hilarious, but also emotionally invested in its characters. So in other words, a fitting and well-made conclusion.",2019-05-22,10,45,33,12,English
31,Calmacil,"Epic and emotional conclusion to the Infinity Saga and the first phases of the MCU.Endings are hard and often a letdown. For Marvel to get it so right is an incredible achievment.This movie has so many awesome moments, it would take about three hours to list them all.According to box office, everyone and their mother has already seen it. But if you haven‘t, go see it in the biggest cinema you find.",2019-05-07,10,48,35,13,English
32,The-Lucky-Lucas,"After being the 22nd movie in the franchise, it brings the series to new heights. This movie is best benefited by those who have watched most of, if not all of the Marvel films. Throwbacks and characters appear from more than last decade of movies. The acting and comedy is on point with every joke hitting perfectly and every actor showing their passion for the role. The movies set pieces are perfect with sets from past movies. The action, humor and overall story telling shows the passion that not only the Russo brothers had for this film but everyone involved. The story concludes the 22 films perfectly while also leaving character arcs open for future MCU movies. This movie deserves the praise and excites me for future MCU movies in the future. This movie is a roller coaster which can be benefited most by those who have seen many of the other marvel films. Thank you to all those involved in the production of this movie, you have created a great films!",2019-05-07,10,48,35,13,English
33,HarrisonPL,"Must watch especially when you are real Marvel fan! Easter Eggs, catchy phrases, some great scenes (Portals!) and absolutely great music, by Alan Silvestri",2019-05-18,9,48,35,13,English
34,TJAMES6,It's a little to long in the beginning but great middle and ending. I would like to know what's next. This movie is something that need another Sequel,2019-05-19,8,48,35,13,English
35,AmirhShamloo,The Best super-heroic movie EVER! The MOST Sentimental movie MCU has ever revealed. It's about 3 hours but you just get lost in the movie and suddenly find out the movie has finished. It makes you laugh and then brings your tears out and leaves you confused and stunned. EXCELLENT!!!,2019-05-03,10,55,40,15,English
38,JayMoe,"Summary: Avengers Endgame is like starting to enjoy the best sex of your life, and just when you get to that special moment.....your kids walk into your bedroom. Negatives: There are some girl power scenes that are just too conspicuous. I would have rather had the messages conveyed to me in a more subtle way and not rammed down my throat. Speaking of conspicuous, Bree Larson is out of place in Endgame. Her scenes with the other cast members in some way seem as if they were not a part of the original plan for the movie. The chemistry was just not there. I don't have a problem with Bree or her causes, she can express her opinion on whatever she likes. I just don't think she is ready to take the mantle as Marvels next big attraction. The next problem I had with Endgame is some of the character arcs the directors decided to use for Thor and Hulk. There is definitely some room for improvement. Now for the positives! The movie, for the most part, is a fantastical journey of over 11 years culminated into one giant thank you to the fans of the comic, and moviegoers alike. I loved the action, the heartache, and the triumphal moments that Endgame provided over the 3 hours of film time. You find yourself cheering, crying, and on the edge of your seat at times wanting to see your favorite Avenger give his or her due to Thanos. Thor and Rocket are hilarious! This movie is not a waste of time and you will be thoroughly entertained.",2019-04-26,7,47,34,13,English
39,MarvelJoe,"This movie is more emotional than Infinity War. 22 movies, all characters, character development, humor, intense moment, coming together in one movie. Some people probably don't understand the movie or not what they excepted, but what you get is what you got.",2019-04-28,10,36,26,10,English
40,Ken_Heisenberg,"Yes the movie is that good. For any Marvel universe fan this is a must-see movie as it is the last one and arguably the best one. It's a pity that some of the heroes die, which means we definitely won't see them again. The ending is very beatiful.",2019-05-01,8,43,31,12,English
41,noobmaster,"This movie is a solid 10/10 . I know its not perfect but it is a great movie . The action, drama , emotional content and humor is very good . As a long time MCU fan the emotions this movie gave me was heartwarming and heartbreaking . Most hater will nitpick every lil things but in general they re ruining their movie experience and as far as nitpicking goes most of them dont even  make sense it kinda seems like their personal agenda or something to just hate on the movie (DC fan boi alert) . We have been taking the MCU for granted , sure they make tons of money now but rather than hating on everything just be happy to see a movie of this scale . Tbh i appreciate DCEU s efforts but they have spoiled their iconic characters like superman and batman , im still onboard for the next JL film i hope they dont screw it up.",2019-04-29,10,43,31,12,English
42,Ellessar,"It's a good conclusion to a 21 movie saga.  It's not perfect, a little longer than it needs to be, but it's a very enjoyable film.  A trip down memory lane of 10 years of marvel movies.",2019-04-26,9,50,36,14,English
43,niolax,"This movie was the best movie that the MCU has made, in fact, i dare to say that it is the best movie ever. It is emotional, epic and it gives you chills because of its greatness. It has incredible action scenes and many easter eggs that marvel fans can find. It is definitely worth watching. The reason it is so incredible is because every movie the MCU made was made thinking in this last movie and you can clearly see it.",2019-04-29,10,50,36,14,English
44,D3M0N07,"Best Avengers movie. . .GOOD story line, GOOD emotional impact, GOOD ending, GOOD Action. . .everything make this movie best. . .",2019-04-28,10,46,33,13,English
45,Ilias_Ksle,"Easily one of my favorite movies out there. It is a must watch for all audiences. It is thrilling and captivating, especially the ending. I loved how the plot was written and the fact that I watched the movie in a Dolby Atmos room felt like I had the immersion. You won't regret watching this movie, so what are you waiting?",2019-05-06,10,46,33,13,English
46,SmashEBrada,"Sure, the first act's pacing is kinda off, and some of the characters are extremely underrepresented (ex. Captain Marvel, Valkyrie, Shuri), but due to just the right amount of fan service and the best final act in Marvel history make this movie one of the best in Marvel Cinematic Universe and one of the best of 2019.",2019-05-04,9,46,33,13,English
47,DevPrakash,"Nothing wrong in this 22nd Movie by Marvel Studios. An epic conclusion and a tragic end. Every dialogues, scenes are meticulously scripted hats off to Russo Brothers and Executive Producer Joss Whedon.",2019-04-27,10,46,33,13,English
49,GotHurt,"Funny, exciting, and shocking if you weren't already spoiled by someone. Avengers: Endgame does an amazing job of wrapping up 11 years of the Marvel Cinematic Universe. If you've been with the series all along, then you are guaranteed to cry at least 3 times during the movie, and use the bathroom right before you enter the theater!",2019-05-21,10,53,38,15,English
50,Deependra,"Not being a blind fanboy or been effected by hype, I can say that,The end game definitely lives up the hype but, only for last 30-45mins. The first half of the movie was filled up more with funny humour and unexpected condition of heroes after losing to Thanos in infinity war. Inshort, it falls flat in my opinion.I personally feel that Infinity war was better than end game due to ""powerful"" foundation of story and the fear of Thanos was very well projected.",2019-04-29,8,49,35,14,English
51,The_LizardKing,"This movie wraps up the wonderful Marvel Cinematic Universe amazingly. It is very entertaining, intense, and emotional. The jokes aren't as good as in other movies, like Spiderman or Thor: Ragnarok, but they still exist. The plot wasn't what I expected and there are a lot of plot twists and entertaining characters. Overall, I give this movie a 10 out of 10 and it is probably my second favorite Marvel Movie behind Thor: Ragnarok.",2019-05-10,10,49,35,14,English
52,sizukajingjing,As a fans of Marvel. Endgame gives me a perfect end for the first stage of Marvel universe,2019-04-26,10,35,25,10,English
53,HealingToolbox,"Much, much better than it needed to be.  KPCC critics were right, the best scenes are not CGI or action, they are dialogue scenes.  You can't say that for any other Marvel movie I can recall.  I loved the whole Thor goes to pot arc.  It added much dimension to the character.  In the credits the main Avengers actors each sign their name in handwriting.  The whole she-bang, and this movie--definitely worth putting your name to.",2019-05-05,9,52,37,15,English
54,seifalnasr,best movie for me i love the marvel movies and i hope to stay like that and i love all heroes but i Waite the best movie black wood,2019-05-22,9,45,32,13,English
56,NezharMC,"A movie that seems like 3 movies fused: A part about regret and defeat, a part about a time heist and another that is the great battle we've all been waiting for.The humor is hit or miss, with some jokes being repeated too many times (Fat Thor). The time travel part creates a huge amount of plotholes, but it's interesting indeed.The movie lends too much time for the first part, filling much of the 3 hours of the movie. The main characters on this movie are the original avengers, whose story ends in this movie. The best part about this movie is how it ties up all the storylines of the MCU in a satisfying conclusion.It is a worse movie than Infinity War but it definitely isn't a disappointment. However it gives me the idea that the future of the MCU won't be that great, seeing as the most important Avengers in the next phase are mostly absent (I still don't see Captain Marvel as the leader of the New Avengers, it is still an undeveloped character).Hawkeye/Ronin's storyline is compelling and Scarlett Johansson works the best as Black Widow in this movie, although her sacrifice scene is a bit odd.The final battle against Thanos is compelling although being time travel Thanos makes it less dramatic. The battle between Thanos and Scarlet Witch could have been more emotional with a Thanos that killed Vision.Tony Stark's sacrifice is compelling as the end of Stark's character development, becoming a symbol for the hope of humanity and the Avengers. From being an arrogant and egotistical man to a selfless yet still arrogant hero, fighting for the future.",2019-05-03,8,45,32,13,English
58,mwrvelz,I have no idea how to describe this movie without the word EPIC. Finally a complete end to the firts Marvel's superheroes.,2019-04-27,10,45,32,13,English
59,Ruslan1327,"This final...this epic, it is not transferable! This film is a must-see! Spoiler! I still can't get over Tony stark's death!",2019-05-07,10,45,32,13,English
61,Shangchaos,"Great movie, sadly some of the plot holes and overly funny scenes make this movie not perfection. But in summary, this is still a worthwhile movie for MCU's 11-year journey",2019-04-28,8,48,34,14,English
62,Hyperior4200,"The reasons why I like this movie1. Not uninteresting humor.2. Awesome and touching story.3. Many heroes unite like the name 'Avengers'4. Awesome villain(Thanos).5. Many awesome lines (I love you 3000, Avengers assemble, Whatever it takes, etc.)6. Great action scene7. The successful final8. Lots of Unexpected things9. Iron Man10. IT'S MARVEL!",2019-05-20,10,51,36,15,English
63,yoshi594,"A satisfying end to the infinity war saga but the way they did it was also a cheap cop out. Time travel is a cheap way to beat an enemy, albeit the way they handled time travel is refreshing . Marvel could have looked to the comics for inspiration and even extend the thanos/infinity stone saga even more so.This movie is 100% fan service as they close the book on the future of the original avengers bar Hulk.",2019-05-24,8,44,31,13,English
64,Infinity_Gauntl,Awesome Movie!! I'm not going to spoil it for anyone. This is a must see. Action packed and a tear jerker all in one!There is so much here especially if youve ever been a fan of the comics of just watched the MCU movies!,2019-05-08,10,44,31,13,English
65,SYMP4THY,"It was amazing. Nothing more nothing less, and I am so glad, that they give this movie so much room in story telling. Definitely worth three hours from my free time. I can only recommend this movie.",2019-04-28,10,44,31,13,English
66,Moviecritic43,This is the best MCU film by far. I didn’t think it could get any better than infinity war. I was wrong. Endgame is incredibly emotional and amazing and is a great conclusion to the infinity saga. Endgame is also one of the best superhero films I’ve ever seen.,2019-04-29,10,44,31,13,English
